{
  "$schema": "https://json-schema.org/draft/2020-12/schema",
  "$id": "https://aergia.local/contracts/evidence-packet.schema.json",
  "title": "Aergia tailoring evidence packet protocol v1",
  "type": "object",
  "additionalProperties": false,
  "required": [
    "protocol_version",
    "session_id",
    "application_id",
    "cv_id",
    "expires_at",
    "base_revision",
    "base_hash",
    "requirements_hash",
    "profile_hash",
    "supported_operations",
    "job",
    "cv",
    "profile",
    "protected_facts",
    "library",
    "requirements"
  ],
  "properties": {
    "protocol_version": {"const": 1},
    "session_id": {"type": "string", "minLength": 1, "maxLength": 36},
    "application_id": {"type": "string", "minLength": 1, "maxLength": 36},
    "cv_id": {"type": "string", "minLength": 1, "maxLength": 36},
    "expires_at": {"type": "string", "format": "date-time"},
    "base_revision": {"type": "integer", "minimum": 1},
    "base_hash": {"type": "string", "pattern": "^[0-9a-f]{64}$"},
    "requirements_hash": {"type": "string", "pattern": "^[0-9a-f]{64}$"},
    "profile_hash": {"type": "string", "pattern": "^[0-9a-f]{64}$"},
    "supported_operations": {
      "type": "array",
      "minItems": 1,
      "maxItems": 32,
      "items": {"type": "string", "minLength": 1, "maxLength": 64}
    },
    "job": {
      "type": "object",
      "additionalProperties": false,
      "required": ["company", "role", "description"],
      "properties": {
        "company": {"type": "string", "maxLength": 255},
        "role": {"type": "string", "maxLength": 255},
        "job_url": {"type": ["string", "null"], "maxLength": 2048},
        "description": {"type": "string", "maxLength": 100000}
      }
    },
    "cv": {
      "type": "object",
      "additionalProperties": false,
      "required": ["id", "title", "sections"],
      "properties": {
        "id": {"type": "string", "minLength": 1, "maxLength": 36},
        "title": {"type": "string", "maxLength": 255},
        "sections": {"type": ["array", "object"]}
      }
    },
    "target_cv": {
      "type": ["object", "null"],
      "additionalProperties": false,
      "required": ["id", "title", "sections"],
      "properties": {
        "id": {"type": "string", "minLength": 1, "maxLength": 128},
        "title": {"type": "string", "maxLength": 255},
        "sections": {"type": ["array", "object"]}
      }
    },
    "profile": {"type": "object"},
    "protected_facts": {"type": "object"},
    "library": {
      "type": "array",
      "maxItems": 100,
      "items": {
        "type": "object",
        "additionalProperties": false,
        "required": ["id", "kind", "content_hash", "payload"],
        "properties": {
          "id": {"type": "string", "minLength": 1, "maxLength": 128},
          "kind": {"type": "string", "maxLength": 32},
          "content_hash": {"type": "string", "pattern": "^[0-9a-f]{64}$"},
          "payload": {"type": "array", "maxItems": 100, "items": {"type": "object"}}
        }
      }
    },
    "requirements": {
      "type": "array",
      "maxItems": 100,
      "items": {"type": "object"}
    }
  }
}
