{
  "protocol_version": 1,
  "session_id": "session-1",
  "application_id": "application-1",
  "cv_id": "cv-1",
  "expires_at": "2026-08-30T20:00:00Z",
  "base_revision": 1,
  "base_hash": "aaaaaaaaaaaaaaaaaaaaaaaaaaaaaaaaaaaaaaaaaaaaaaaaaaaaaaaaaaaaaaaa",
  "requirements_hash": "bbbbbbbbbbbbbbbbbbbbbbbbbbbbbbbbbbbbbbbbbbbbbbbbbbbbbbbbbbbbbbbb",
  "profile_hash": "cccccccccccccccccccccccccccccccccccccccccccccccccccccccccccccccc",
  "supported_operations": [
    "replace_description",
    "rewrite_rich_text",
    "remove_bullet",
    "reorder_bullets",
    "remove_entry",
    "reorder_entries",
    "add_library_entry",
    "report_gap"
  ],
  "job": {
    "company": "Example Labs",
    "role": "Platform Engineer",
    "job_url": null,
    "description": "Build reliable Python API services."
  },
  "cv": {
    "id": "cv-1",
    "title": "Example Labs — Platform Engineer",
    "sections": [
      {
        "id": "section-experience",
        "type": "experience",
        "title": "Experience",
        "enabled": true,
        "data": [
          {
            "id": "entry-1",
            "description": "Built reliable API services.",
            "summary": [
              {
                "id": "block-1",
                "type": "bullet_list",
                "items": [
                  {"id": "item-1", "text": "Built reliable API services."}
                ]
              }
            ]
          }
        ]
      }
    ]
  },
  "target_cv": {
    "id": "target-cv-1",
    "title": "Fresh tailored draft",
    "sections": [
      {
        "id": "target-profile",
        "type": "profile",
        "title": "Profile",
        "enabled": true,
        "data": {"name": "Example User", "summary": ""}
      },
      {
        "id": "target-experience",
        "type": "experience",
        "title": "Experience",
        "enabled": true,
        "data": []
      }
    ]
  },
  "profile": {"name": "Example User"},
  "protected_facts": {
    "profile": {"name": "Example User"},
    "entries": []
  },
  "library": [],
  "requirements": []
}
